,Importance,Level,Job Zone,Code,Occupation
0,78,64,2,47-2221.00,Structural Iron and Steel Workers
1,72,57,2,47-2171.00,Reinforcing Iron and Rebar Workers
2,72,55,2,27-2021.00,Athletes and Sports Competitors Bright Outlook
3,69,70,3,47-2022.00,Stonemasons
4,69,63,3,33-2011.00,Firefighters
5,69,57,2,47-2021.00,Brickmasons and Blockmasons
6,69,57,2,47-2061.00,Construction Laborers
7,69,57,2,53-7062.00,"Laborers and Freight, Stock, and Material Movers, Hand"
8,69,55,2,37-3013.00,Tree Trimmers and Pruners
9,66,57,1,47-5011.00,"Derrick Operators, Oil and Gas"
10,66,57,2,49-9095.00,Manufactured Building and Mobile Home Installers
11,66,55,2,47-5081.00,Helpers--Extraction Workers
12,66,55,2,53-7121.00,"Tank Car, Truck, and Ship Loaders"
13,66,54,1,45-2092.00,"Farmworkers and Laborers, Crop, Nursery, and Greenhouse"
14,66,54,2,47-5043.00,"Roof Bolters, Mining"
15,66,52,2,49-9044.00,Millwrights
16,66,50,2,51-9191.00,Adhesive Bonding Machine Operators and Tenders
17,66,45,3,27-2031.00,Dancers
18,63,64,1,45-4021.00,Fallers
19,63,61,2,47-2041.00,Carpet Installers
20,63,59,2,47-3011.00,"Helpers--Brickmasons, Blockmasons, Stonemasons, and Tile and Marble Setters"
21,63,55,2,49-3093.00,Tire Repairers and Changers
22,63,54,2,39-6011.00,Baggage Porters and Bellhops
23,63,54,1,47-5051.00,"Rock Splitters, Quarry"
24,63,52,2,49-3043.00,Rail Car Repairers
25,63,50,2,51-4071.00,Foundry Mold and Coremakers
26,60,57,2,47-4031.00,Fence Erectors
27,60,55,2,31-1132.00,Orderlies
28,60,54,3,39-9031.00,Exercise Trainers and Group Fitness Instructors
29,60,54,3,49-3041.00,Farm Equipment Mechanics and Service Technicians
30,60,54,2,51-9195.00,"Molders, Shapers, and Casters, Except Metal and Plastic"
31,60,53,1,45-3031.00,Fishing and Hunting Workers
32,60,52,2,47-2031.00,Carpenters
33,60,52,2,51-4191.00,"Heat Treating Equipment Setters, Operators, and Tenders, Metal and Plastic"
34,60,52,1,47-3014.00,"Helpers--Painters, Paperhangers, Plasterers, and Stucco Masons"
35,60,52,2,47-4051.00,Highway Maintenance Workers
36,60,52,2,49-9011.00,Mechanical Door Repairers
37,56,55,2,45-4011.00,Forest and Conservation Workers
38,56,54,2,53-1041.00,Aircraft Cargo Handling Supervisors
39,56,54,3,49-3042.00,"Mobile Heavy Equipment Mechanics, Except Engines"
40,56,54,2,47-4061.00,Rail-Track Laying and Maintenance Equipment Operators
41,56,54,1,47-5071.00,"Roustabouts, Oil and Gas"
42,56,52,1,47-2161.00,Plasterers and Stucco Masons
43,56,50,2,51-7011.00,Cabinetmakers and Bench Carpenters
44,56,48,3,33-3051.00,Police and Sheriff's Patrol Officers
45,56,48,2,51-4023.00,"Rolling Machine Setters, Operators, and Tenders, Metal and Plastic"
46,56,46,3,47-2011.00,Boilermakers
47,56,46,2,51-9198.00,Helpers--Production Workers
48,56,46,3,31-1131.00,Nursing Assistants
49,56,46,2,53-7081.00,Refuse and Recyclable Material Collectors
50,56,46,2,47-4091.00,Segmental Pavers
51,56,45,3,49-9092.00,Commercial Divers
52,56,45,2,47-2081.00,Drywall and Ceiling Tile Installers
53,56,45,2,51-7021.00,Furniture Finishers
54,56,45,2,51-7042.00,"Woodworking Machine Setters, Operators, and Tenders, Except Sawing"
55,53,57,1,47-2051.00,Cement Masons and Concrete Finishers
56,53,57,2,47-3016.00,Helpers--Roofers
57,53,55,2,53-3011.00,"Ambulance Drivers and Attendants, Except Emergency Medical Technicians"
58,53,55,2,49-9051.00,Electrical Power-Line Installers and Repairers
59,53,55,3,33-1011.00,First-Line Supervisors of Correctional Officers
60,53,55,2,47-2053.00,Terrazzo Workers and Finishers
61,53,54,2,45-2093.00,"Farmworkers, Farm, Ranch, and Aquacultural Animals"
62,53,54,2,49-9098.00,"Helpers--Installation, Maintenance, and Repair Workers"
63,53,54,1,37-3011.00,Landscaping and Groundskeeping Workers
64,53,52,2,53-7051.00,Industrial Truck and Tractor Operators
65,53,52,2,53-3033.00,Light Truck Drivers
66,53,52,2,53-5011.00,Sailors and Marine Oilers
67,53,50,2,47-3012.00,Helpers--Carpenters
68,53,48,3,49-9021.00,"Heating, Air Conditioning, and Refrigeration Mechanics and Installers"
69,53,48,2,51-4072.00,"Molding, Coremaking, and Casting Machine Setters, Operators, and Tenders, Metal and Plastic"
70,53,48,2,43-5053.00,"Postal Service Mail Sorters, Processors, and Processing Machine Operators"
71,53,48,2,51-9012.00,"Separating, Filtering, Clarifying, Precipitating, and Still Machine Setters, Operators, and Tenders"
72,53,46,2,51-9041.00,"Extruding, Forming, Pressing, and Compacting Machine Setters, Operators, and Tenders"
73,53,46,2,47-2071.00,"Paving, Surfacing, and Tamping Equipment Operators"
74,53,46,2,47-2181.00,Roofers
75,53,46,2,47-2211.00,Sheet Metal Workers
76,53,46,2,51-9195.03,"Stone Cutters and Carvers, Manufacturing"
77,53,46,2,47-2044.00,Tile and Stone Setters
78,53,45,1,45-2091.00,Agricultural Equipment Operators
79,53,45,2,39-2021.00,Animal Caretakers
80,53,45,2,33-9011.00,Animal Control Workers
81,53,45,2,49-3022.00,Automotive Glass Installers and Repairers
82,53,45,2,51-9193.00,Cooling and Freezing Equipment Operators and Tenders
83,53,45,2,51-9021.00,"Crushing, Grinding, and Polishing Machine Setters, Operators, and Tenders"
84,53,45,2,51-9032.00,"Cutting and Slicing Machine Setters, Operators, and Tenders"
85,53,45,2,51-4021.00,"Extruding and Drawing Machine Setters, Operators, and Tenders, Metal and Plastic"
86,53,45,2,51-2051.00,Fiberglass Laminators and Fabricators
87,53,45,3,33-1021.00,First-Line Supervisors of Firefighting and Prevention Workers
88,53,45,2,47-2042.00,"Floor Layers, Except Carpet, Wood, and Hard Tiles"
89,53,45,1,47-2043.00,Floor Sanders and Finishers
90,53,45,2,51-4033.00,"Grinding, Lapping, Polishing, and Buffing Machine Tool Setters, Operators, and Tenders, Metal and Plastic"
91,53,45,3,49-9041.00,Industrial Machinery Mechanics
92,53,45,2,51-4034.00,"Lathe and Turning Machine Tool Setters, Operators, and Tenders, Metal and Plastic"
93,53,45,2,51-4051.00,Metal-Refining Furnace Operators and Tenders
94,53,45,3,49-3052.00,Motorcycle Mechanics
95,53,45,3,51-7032.00,"Patternmakers, Wood"
96,53,45,5,29-1123.00,Physical Therapists
97,53,45,2,47-2151.00,Pipelayers
98,53,45,2,49-9096.00,Riggers
99,53,45,1,47-4071.00,Septic Tank Servicers and Sewer Pipe Cleaners
100,53,45,2,51-3023.00,Slaughterers and Meat Packers
101,53,45,2,51-9197.00,Tire Builders
102,53,45,2,53-7073.00,Wellhead Pumpers
103,53,43,2,53-6031.00,Automotive and Watercraft Service Attendants
104,53,43,1,53-7011.00,Conveyor Operators and Tenders
105,53,43,2,51-2031.00,Engine and Other Machine Assemblers
106,53,43,2,47-2121.00,Glaziers
107,53,43,2,47-2132.00,"Insulation Workers, Mechanical"
108,53,43,3,29-2061.00,Licensed Practical and Licensed Vocational Nurses
109,53,43,3,31-2011.00,Occupational Therapy Assistants
110,53,43,3,31-2021.00,Physical Therapist Assistants
111,53,43,2,49-3092.00,Recreational Vehicle Service Technicians
112,53,43,2,47-5013.00,"Service Unit Operators, Oil and Gas"
113,53,43,2,51-6062.00,"Textile Cutting Machine Setters, Operators, and Tenders"
114,53,43,2,51-6064.00,"Textile Winding, Twisting, and Drawing Out Machine Setters, Operators, and Tenders"
115,50,54,2,33-3012.00,Correctional Officers and Jailers
116,50,54,2,47-5022.00,"Excavating and Loading Machine and Dragline Operators, Surface Mining"
117,50,50,2,47-5041.00,Continuous Mining Machine Operators
118,50,50,2,51-6093.00,Upholsterers
119,50,48,2,53-3032.00,Heavy and Tractor-Trailer Truck Drivers
120,50,48,2,47-3015.00,"Helpers--Pipelayers, Plumbers, Pipefitters, and Steamfitters"
121,50,46,3,33-3011.00,Bailiffs
122,50,46,3,29-9093.00,Surgical Assistants
123,50,45,2,49-3021.00,Automotive Body and Related Repairers
124,50,45,3,49-3031.00,Bus and Truck Mechanics and Diesel Engine Specialists
125,50,45,3,47-4041.00,Hazardous Materials Removal Workers
126,50,45,3,49-9071.00,"Maintenance and Repair Workers, General"
127,50,45,2,53-5022.00,Motorboat Operators
128,50,45,3,47-2152.00,"Plumbers, Pipefitters, and Steamfitters"
129,50,45,2,53-4013.00,"Rail Yard Engineers, Dinkey Operators, and Hostlers"
130,50,45,4,29-1141.00,Registered Nurses
131,50,45,3,33-3052.00,Transit and Railroad Police
132,50,45,3,49-9081.00,Wind Turbine Service Technicians
133,50,43,5,25-2059.01,Adapted Physical Education Specialists
134,50,43,5,29-9091.00,Athletic Trainers
135,50,43,1,51-9031.00,"Cutters and Trimmers, Hand"
136,50,43,2,51-4031.00,"Cutting, Punching, and Press Machine Setters, Operators, and Tenders, Metal and Plastic"
137,50,43,1,35-9011.00,Dining Room and Cafeteria Attendants and Bartender Helpers
138,50,43,2,53-3031.00,Driver/Sales Workers
139,50,43,3,37-1012.00,"First-Line Supervisors of Landscaping, Lawn Service, and Groundskeeping Workers"
140,50,43,3,19-4071.00,Forest and Conservation Technicians
141,50,43,2,47-2131.00,"Insulation Workers, Floor, Ceiling, and Wall"
142,50,43,3,37-2011.00,"Janitors and Cleaners, Except Maids and Housekeeping Cleaners"
143,50,43,2,53-7063.00,Machine Feeders and Offbearers
144,50,43,3,49-9043.00,"Maintenance Workers, Machinery"
145,50,43,3,31-9011.00,Massage Therapists
146,50,43,2,31-9093.00,Medical Equipment Preparers
147,50,43,3,27-1026.00,Merchandise Displayers and Window Trimmers
148,50,43,2,51-9023.00,"Mixing and Blending Machine Setters, Operators, and Tenders"
149,50,43,2,47-2073.00,Operating Engineers and Other Construction Equipment Operators
150,50,43,2,49-3053.00,Outdoor Power Equipment and Other Small Engine Mechanics
151,50,43,2,53-7064.00,"Packers and Packagers, Hand"
152,50,43,2,37-3012.00,"Pesticide Handlers, Sprayers, and Applicators, Vegetation"
153,50,43,2,51-4193.00,"Plating Machine Setters, Operators, and Tenders, Metal and Plastic"
154,50,43,2,51-4052.00,"Pourers and Casters, Metal"
155,50,43,2,51-5112.00,Printing Press Operators
156,50,43,2,53-7072.00,"Pump Operators, Except Wellhead Pumpers"
157,50,43,3,51-2041.00,Structural Metal Fabricators and Fitters
158,50,43,3,49-2022.00,"Telecommunications Equipment Installers and Repairers, Except Line Installers"
159,50,43,2,49-9052.00,Telecommunications Line Installers and Repairers
160,50,43,2,51-4194.00,"Tool Grinders, Filers, and Sharpeners"
161,50,43,2,51-4122.00,"Welding, Soldering, and Brazing Machine Setters, Operators, and Tenders"
162,50,41,2,45-2021.00,Animal Breeders
163,50,41,2,47-5032.00,"Explosives Workers, Ordnance Handling Experts, and Blasters"
164,50,41,2,49-9031.00,Home Appliance Repairers
165,50,41,3,49-3051.00,Motorboat Mechanics and Service Technicians
166,50,41,2,47-2141.00,"Painters, Construction and Maintenance"
167,50,41,2,51-7041.00,"Sawing Machine Setters, Operators, and Tenders, Wood"
168,50,41,2,47-2231.00,Solar Photovoltaic Installers
169,50,41,2,53-7065.00,Stockers and Order Fillers
170,50,41,2,51-6061.00,Textile Bleaching and Dyeing Machine Operators and Tenders
171,50,39,2,39-4021.00,Funeral Attendants
172,47,50,2,33-9092.00,"Lifeguards, Ski Patrol, and Other Recreational Protective Service Workers"
173,47,48,2,47-5012.00,"Rotary Drill Operators, Oil and Gas"
174,47,48,2,33-9093.00,Transportation Security Screeners
175,47,45,2,31-1133.00,Psychiatric Aides
176,47,43,3,49-3011.00,Aircraft Mechanics and Service Technicians
177,47,43,2,39-2011.00,Animal Trainers
178,47,43,2,49-3091.00,Bicycle Repairers
179,47,43,2,51-3021.00,Butchers and Meat Cutters
180,47,43,5,29-1011.00,Chiropractors
181,47,43,3,39-4011.00,Embalmers
182,47,43,2,51-9051.00,"Furnace, Kiln, Oven, Drier, and Kettle Operators and Tenders"
183,47,43,2,47-3013.00,Helpers--Electricians
184,47,43,2,51-4081.00,"Multiple Machine Tool Setters, Operators, and Tenders, Metal and Plastic"
185,47,43,3,31-2012.00,Occupational Therapy Aides
186,47,43,2,53-7062.04,Recycling and Reclamation Workers
187,47,43,3,47-2152.04,Solar Thermal Installers and Technicians
188,47,43,2,47-4099.03,Weatherization Installers and Technicians
189,47,41,4,27-2022.00,Coaches and Scouts
190,47,41,2,51-9161.00,Computer Numerically Controlled Tool Operators
191,47,41,4,29-1141.03,Critical Care Nurses
192,47,41,2,53-7031.00,Dredge Operators
193,47,41,2,51-4032.00,"Drilling and Boring Machine Tool Setters, Operators, and Tenders, Metal and Plastic"
194,47,41,3,49-2092.00,"Electric Motor, Power Tool, and Related Repairers"
195,47,41,4,33-3031.00,Fish and Game Wardens
196,47,41,2,53-2031.00,Flight Attendants
197,47,41,2,31-1121.00,Home Health Aides
198,47,41,1,45-4022.00,Logging Equipment Operators
199,47,41,2,51-4035.00,"Milling and Planing Machine Setters, Operators, and Tenders, Metal and Plastic"
200,47,41,2,31-2022.00,Physical Therapist Aides
201,47,41,3,51-9195.05,"Potters, Manufacturing"
202,47,41,3,29-2053.00,Psychiatric Technicians
203,47,41,3,49-2021.00,"Radio, Cellular, and Tower Equipment Installers and Repairers"
204,47,41,3,49-9097.00,Signal and Track Switch Repairers
205,47,41,3,29-2056.00,Veterinary Technologists and Technicians
206,47,39,2,51-2011.00,"Aircraft Structure, Surfaces, Rigging, and Systems Assemblers"
207,47,39,3,49-3023.00,Automotive Service Technicians and Mechanics
208,47,39,3,53-5021.00,"Captains, Mates, and Pilots of Water Vessels"
209,47,39,2,51-9011.00,Chemical Equipment Operators and Tenders
210,47,39,1,35-9021.00,Dishwashers
211,47,39,2,43-9051.00,"Mail Clerks and Mail Machine Operators, Except Postal Service"
212,47,39,2,51-2092.00,Team Assemblers
213,47,37,3,35-2013.00,"Cooks, Private Household"
214,47,37,2,43-5021.00,Couriers and Messengers
215,47,37,2,51-9022.00,"Grinding and Polishing Workers, Hand"
216,47,37,2,43-5052.00,Postal Service Mail Carriers
217,47,36,2,31-1122.00,Personal Care Aides
218,47,36,2,37-2021.00,Pest Control Workers
219,47,34,2,43-5041.00,"Meter Readers, Utilities"
220,47,30,1,37-2012.00,Maids and Housekeeping Cleaners
221,44,46,3,47-2111.00,Electricians
222,44,43,2,51-6091.00,"Extruding and Forming Machine Setters, Operators, and Tenders, Synthetic and Glass Fibers"
223,44,43,3,33-1012.00,First-Line Supervisors of Police and Detectives
224,44,43,3,29-2055.00,Surgical Technologists
225,44,41,3,53-7021.00,Crane and Tower Operators
226,44,41,3,45-1011.00,"First-Line Supervisors of Farming, Fishing, and Forestry Workers"
227,44,41,2,47-5044.00,"Loading and Moving Machine Operators, Underground Mining"
228,44,41,2,49-9094.00,Locksmiths and Safe Repairers
229,44,41,2,39-9011.01,Nannies
230,44,41,2,51-9111.00,Packaging and Filling Machine Operators and Tenders
231,44,41,3,29-2034.00,Radiologic Technologists and Technicians
232,44,41,3,53-5031.00,Ship Engineers
233,44,41,2,43-5071.00,"Shipping, Receiving, and Inventory Clerks"
234,44,41,2,31-9096.00,Veterinary Assistants and Laboratory Animal Caretakers
235,44,39,4,11-9179.01,Fitness and Wellness Coordinators
236,44,39,3,51-4061.00,"Model Makers, Metal and Plastic"
237,44,39,2,51-5113.00,Print Binding and Finishing Workers
238,44,39,2,33-9032.00,Security Guards
239,44,39,3,51-8021.00,Stationary Engineers and Boiler Operators
240,44,38,2,51-9141.00,Semiconductor Processing Technicians
241,44,37,2,51-8013.03,Biomass Plant Technicians
242,44,37,2,51-2022.00,Electrical and Electronic Equipment Assemblers
243,44,37,2,51-9195.04,"Glass Blowers, Molders, Benders, and Finishers"
244,44,37,2,47-2072.00,Pile Driver Operators
245,44,37,2,43-5051.00,Postal Service Clerks
246,44,36,3,49-2094.00,"Electrical and Electronics Repairers, Commercial and Industrial Equipment"
247,44,34,2,49-9091.00,"Coin, Vending, and Amusement Machine Servicers and Repairers"
248,44,34,2,51-3093.00,Food Cooking Machine Operators and Tenders
249,44,34,5,29-1161.00,Nurse Midwives
250,44,34,5,29-1122.00,Occupational Therapists
251,44,32,2,37-1011.00,First-Line Supervisors of Housekeeping and Janitorial Workers
252,44,32,4,25-4013.00,Museum Technicians and Conservators
253,44,32,2,35-3031.00,Waiters and Waitresses
254,44,Not available,2,49-9045.00,"Refractory Materials Repairers, Except Brickmasons"
255,42,37,2,53-4022.00,"Railroad Brake, Signal, and Switch Operators and Locomotive Firers"
256,41,45,2,53-7041.00,Hoist and Winch Operators
257,41,41,2,51-8099.01,Biofuels Processing Technicians
258,41,41,3,27-4031.00,"Camera Operators, Television, Video, and Film"
259,41,41,2,51-9124.00,"Coating, Painting, and Spraying Machine Setters, Operators, and Tenders"
260,41,41,2,49-9099.01,Geothermal Technicians
261,41,41,2,47-2142.00,Paperhangers
262,41,41,3,29-1124.00,Radiation Therapists
263,41,41,2,51-4121.00,"Welders, Cutters, Solderers, and Brazers"
264,41,39,2,31-9099.02,Endoscopy Technicians
265,41,39,4,19-1032.00,Foresters
266,41,39,2,51-4192.00,"Layout Workers, Metal and Plastic"
267,41,39,3,49-9063.00,Musical Instrument Repairers and Tuners
268,41,37,2,51-9192.00,"Cleaning, Washing, and Metal Pickling Equipment Operators and Tenders"
269,41,37,3,51-9082.00,Medical Appliance Technicians
270,41,37,3,39-4031.00,"Morticians, Undertakers, and Funeral Arrangers"
271,41,37,2,51-8093.00,"Petroleum Pump System Operators, Refinery Operators, and Gaugers"
272,41,36,2,51-8091.00,Chemical Plant and System Operators
273,41,36,3,49-2096.00,"Electronic Equipment Installers and Repairers, Motor Vehicles"
274,41,36,3,47-4021.00,Elevator and Escalator Installers and Repairers
275,41,36,1,45-2041.00,"Graders and Sorters, Agricultural Products"
276,41,36,2,41-2022.00,Parts Salespersons
277,41,36,2,53-4031.00,Railroad Conductors and Yardmasters
278,41,36,2,51-6063.00,"Textile Knitting and Weaving Machine Setters, Operators, and Tenders"
279,41,34,2,51-4022.00,"Forging Machine Setters, Operators, and Tenders, Metal and Plastic"
280,41,34,3,51-7031.00,"Model Makers, Wood"
281,41,32,1,35-3023.01,Baristas
282,41,32,2,51-6042.00,Shoe Machine Operators and Tenders
283,41,30,3,27-1013.00,"Fine Artists, Including Painters, Sculptors, and Illustrators"
284,41,30,2,33-3041.00,Parking Enforcement Workers
285,38,39,3,33-3051.04,Customs and Border Protection Officers
286,38,39,3,17-3024.00,Electro-Mechanical and Mechatronics Technologists and Technicians
287,38,39,2,45-4023.00,Log Graders and Scalers
288,38,37,5,29-1071.01,Anesthesiologist Assistants
289,38,37,2,53-4011.00,Locomotive Engineers
290,38,37,3,51-4041.00,Machinists
291,38,37,4,29-1125.00,Recreational Therapists
292,38,37,3,17-3024.01,Robotics Technicians
293,38,36,3,33-3021.00,Detectives and Criminal Investigators
294,38,36,3,51-8013.04,Hydroelectric Plant Technicians
295,38,36,2,51-9196.00,"Paper Goods Machine Setters, Operators, and Tenders"
296,38,34,3,49-2097.00,Audiovisual Equipment Installers and Repairers
297,38,34,4,27-2032.00,Choreographers
298,38,34,2,53-6021.00,Parking Attendants
299,38,34,3,47-1011.03,Solar Energy Installation Managers
300,38,32,3,27-1012.00,Craft Artists
301,38,32,1,51-6021.00,"Pressers, Textile, Garment, and Related Materials"
302,38,30,4,19-1031.00,Conservation Scientists
303,38,30,1,35-2021.00,Food Preparation Workers
304,35,36,2,51-3091.00,"Food and Tobacco Roasting, Baking, and Drying Machine Operators and Tenders"
305,35,36,2,47-2082.00,Tapers
306,35,34,2,51-2021.00,"Coil Winders, Tapers, and Finishers"
307,35,34,2,47-5023.00,"Earth Drillers, Except Oil and Gas"
308,35,34,2,51-2023.00,Electromechanical Equipment Assemblers
309,35,34,2,43-4181.00,Reservation and Transportation Ticket Agents and Travel Clerks
310,35,34,5,29-1229.06,Sports Medicine Physicians
311,35,32,2,39-9011.00,Childcare Workers
312,35,32,3,49-9012.00,"Control and Valve Installers and Repairers, Except Mechanical Door"
313,35,32,2,35-2014.00,"Cooks, Restaurant"
314,35,32,1,51-3022.00,"Meat, Poultry, and Fish Cutters and Trimmers"
315,35,32,5,29-1229.04,Physical Medicine and Rehabilitation Physicians
316,35,32,3,49-2098.00,Security and Fire Alarm Systems Installers
317,35,30,3,17-3027.01,Automotive Engineering Technicians
318,35,30,3,27-4012.00,Broadcast Technicians
319,35,30,2,51-3092.00,Food Batchmakers
320,35,30,2,35-3041.00,"Food Servers, Nonrestaurant"
321,35,30,3,19-4092.00,Forensic Science Technicians
322,35,30,3,49-9062.00,Medical Equipment Repairers
323,35,30,4,19-1031.03,Park Naturalists
324,35,30,4,39-9032.00,Recreation Workers
325,35,29,2,51-9061.00,"Inspectors, Testers, Sorters, Samplers, and Weighers"
326,35,29,2,53-6061.00,Passenger Attendants
327,35,29,2,53-4041.00,Subway and Streetcar Operators
328,33,35,4,11-9013.00,"Farmers, Ranchers, and Other Agricultural Managers"
329,31,41,3,29-1141.01,Acute Care Nurses
330,31,41,3,51-4111.00,Tool and Die Makers
331,31,39,3,49-1011.00,"First-Line Supervisors of Mechanics, Installers, and Repairers"
332,31,37,2,35-3011.00,Bartenders
333,31,34,3,13-1041.06,Coroners
334,31,34,2,53-7071.00,Gas Compressor and Gas Pumping Station Operators
335,31,34,3,29-1126.00,Respiratory Therapists
336,31,34,4,53-6051.00,Transportation Inspectors
337,31,34,5,29-1229.03,Urologists
338,31,32,3,19-4012.00,Agricultural Technicians
339,31,32,3,53-2012.00,Commercial Pilots
340,31,32,1,35-2011.00,"Cooks, Fast Food"
341,31,32,3,29-2032.00,Diagnostic Medical Sonographers
342,31,32,4,17-3025.00,Environmental Engineering Technologists and Technicians
343,31,32,2,51-9194.00,Etchers and Engravers
344,31,32,4,29-1128.00,Exercise Physiologists
345,31,32,3,33-2021.00,Fire Inspectors and Investigators
346,31,32,3,47-1011.00,First-Line Supervisors of Construction Trades and Extraction Workers
347,31,32,2,35-1012.00,First-Line Supervisors of Food Preparation and Serving Workers
348,31,32,3,33-2022.00,Forest Fire Inspectors and Prevention Specialists
349,31,32,5,29-1151.00,Nurse Anesthetists
350,31,30,5,29-1211.00,Anesthesiologists
351,31,30,3,35-1011.00,Chefs and Head Cooks
352,31,30,2,53-7061.00,Cleaners of Vehicles and Equipment
353,31,30,2,39-3092.00,Costume Attendants
354,31,30,2,41-9011.00,Demonstrators and Product Promoters
355,31,30,2,51-8092.00,Gas Plant Operators
356,31,30,1,51-6011.00,Laundry and Dry-Cleaning Workers
357,31,30,3,29-2035.00,Magnetic Resonance Imaging Technologists
358,31,30,5,29-9099.01,Midwives
359,31,30,2,51-9151.00,Photographic Process Workers and Processing Machine Operators
360,31,30,2,51-6041.00,Shoe and Leather Workers and Repairers
361,31,29,3,29-2031.00,Cardiovascular Technologists and Technicians
362,31,29,2,41-2011.00,Cashiers
363,31,29,4,19-4043.00,"Geological Technicians, Except Hydrologic Technicians"
364,31,29,3,25-4031.00,Library Technicians
365,31,29,2,43-5111.00,"Weighers, Measurers, Checkers, and Samplers, Recordkeeping"
366,31,27,4,19-4021.00,Biological Technicians
367,31,27,4,25-2012.00,"Kindergarten Teachers, Except Special Education"
368,31,25,2,39-1013.00,First-Line Supervisors of Gambling Services Workers
369,31,21,2,39-5093.00,Shampooers
370,28,37,2,53-1042.00,"First-Line Supervisors of Helpers, Laborers, and Material Movers, Hand"
371,28,36,5,29-1141.04,Clinical Nurse Specialists
372,28,36,5,29-1131.00,Veterinarians
373,28,32,3,27-4011.00,Audio and Video Technicians
374,28,32,2,53-6011.00,Bridge and Lock Tenders
375,28,32,2,35-2012.00,"Cooks, Institution and Cafeteria"
376,28,32,2,51-8013.00,Power Plant Operators
377,28,30,4,53-2011.00,"Airline Pilots, Copilots, and Flight Engineers"
378,28,30,3,49-2091.00,Avionics Technicians
379,28,30,3,49-2093.00,"Electrical and Electronics Installers and Repairers, Transportation Equipment"
380,28,30,3,49-2095.00,"Electrical and Electronics Repairers, Powerhouse, Substation, and Relay"
381,28,30,3,47-4011.01,Energy Auditors
382,28,30,2,13-1074.00,Farm Labor Contractors
383,28,30,3,53-1043.00,First-Line Supervisors of Material-Moving Machine and Vehicle Operators
384,28,30,2,11-9051.00,Food Service Managers
385,28,30,5,29-1229.02,Hospitalists
386,28,30,3,17-3027.00,Mechanical Engineering Technologists and Technicians
387,28,30,3,31-9092.00,Medical Assistants
388,28,30,2,17-3029.01,Non-Destructive Testing Specialists
389,28,30,5,29-1171.00,Nurse Practitioners
390,28,30,5,29-1218.00,Obstetricians and Gynecologists
391,28,30,2,43-9071.00,"Office Machine Operators, Except Computer"
392,28,30,5,29-2091.00,Orthotists and Prosthetists
393,28,30,1,51-9123.00,"Painting, Coating, and Decorating Workers"
394,28,30,3,51-4062.00,"Patternmakers, Metal and Plastic"
395,28,30,5,29-1071.00,Physician Assistants
396,28,30,4,21-1092.00,Probation Officers and Correctional Treatment Specialists
397,28,30,2,33-9099.02,Retail Loss Prevention Specialists
398,28,30,1,51-6031.00,Sewing Machine Operators
399,28,30,2,53-6051.07,"Transportation Vehicle, Equipment and Systems Inspectors, Except Aviation"
400,28,30,3,51-8031.00,Water and Wastewater Treatment Plant and System Operators
401,28,29,4,25-2032.00,"Career/Technical Education Teachers, Secondary School"
402,28,29,3,51-9162.00,Computer Numerically Controlled Tool Programmers
403,28,29,3,49-2011.00,"Computer, Automated Teller, and Office Machine Repairers"
404,28,29,3,29-2051.00,Dietetic Technicians
405,28,29,3,51-6092.00,Fabric and Apparel Patternmakers
406,28,29,2,43-4071.00,File Clerks
407,28,29,3,51-1011.00,First-Line Supervisors of Production and Operating Workers
408,28,29,2,43-4121.00,"Library Assistants, Clerical"
409,28,29,3,39-5091.00,"Makeup Artists, Theatrical and Performance"
410,28,29,3,19-4051.02,Nuclear Monitoring Technicians
411,28,29,2,31-9095.00,Pharmacy Aides
412,28,29,3,31-9097.00,Phlebotomists
413,28,29,3,33-3021.02,Police Identification and Records Officers
414,28,29,3,25-2011.00,"Preschool Teachers, Except Special Education"
415,28,29,3,19-4099.01,Quality Control Analysts
416,28,29,4,17-1022.00,Surveyors
417,28,27,2,51-3011.00,Bakers
418,28,27,2,53-3052.00,"Bus Drivers, Transit and Intercity"
419,28,27,3,19-4031.00,Chemical Technicians
420,28,27,5,25-4012.00,Curators
421,28,27,3,31-9091.00,Dental Assistants
422,28,27,4,19-4042.00,"Environmental Science and Protection Technicians, Including Health"
423,28,27,3,13-1041.04,Government Property Inspectors and Investigators
